Symbol,Name,Last Sale,Net Change,% Change,Market Cap,Country,IPO Year,Volume,Sector,Industry
ITT,ITT Inc. Common Stock ,$77.33,0.08,0.104%,6681312000.00,United States,2011,549860,Capital Goods,Fluid Controls
ITUB,Itau Unibanco Banco Holding SA American Depositary Shares (Each repstg 500 Preferred shares),$5.17,0.01,0.194%,50471902152.00,Brazil,,21195746,Finance,Major Banks
ITW,Illinois Tool Works Inc. Common Stock,$200.94,-3.96,-1.933%,63601581245.00,United States,,878930,Technology,Industrial Machinery/Components
IVC,Invacare Corporation Common Stock,$9.64,-0.78,-7.486%,331789954.00,United States,,494860,Health Care,Industrial Specialties
IVH,Ivy High Income Opportunities Fund Common Shares of Beneficial Interest,$13.43,0.01,0.075%,222538256.00,,2013,35407,,
IVR,INVESCO MORTGAGE CAPITAL INC Common Stock,$3.85,0.02,0.522%,888665116.00,United States,2009,10736554,Consumer Services,Real Estate Investment Trusts
IVR^A,Invesco Mortgage Capital Inc. Pfd Ser A,$24.66,-0.07,-0.283%,,United States,,10989,,
IVR^B,Invesco Mortgage Capital Inc. Preferred Series B Cum Fxd to Fltg,$24.45,0.14,0.576%,,United States,,13762,,
IVR^C,INVESCO MORTGAGE CAPITAL INC 7.5% Fixed-to-Floating Series C Cumulative Redeemable Preferred Stock Liquation Preference $25.00 per Share,$24.50,0.17,0.699%,,United States,,48135,,
IVZ,Invesco Ltd Common Stock,$22.59,-0.13,-0.572%,10376380203.00,United States,,2956111,Finance,Investment Managers
IX,Orix Corp Ads Common Stock,$84.47,0.08,0.095%,20602108322.00,Japan,,13947,Finance,Diversified Financial Services
J,Jacobs Engineering Group Inc. Common Stock,$115.00,4.29,3.875%,14959908515.00,United States,,769177,Basic Industries,Military/Government/Technical
JAX,J. Alexander's Holdings Inc. Common Stock,$8.56,0.24,2.885%,128999859.00,,2015,79344,Consumer Services,Restaurants
JBGS,JBG SMITH Properties Common Shares ,$32.56,0.20,0.618%,4313050697.00,United States,2017,405354,Consumer Services,Real Estate Investment Trusts
JBK,Lehman ABS 3.50 3.50% Adjustable Corp Backed Tr Certs GS Cap I,$28.98,-0.145,-0.498%,0.00,United States,,126,Finance,Finance: Consumer Services
JBL,Jabil Inc. Common Stock,$44.84,0.67,1.517%,6733891795.00,United States,1993,937943,Technology,Electrical Products
JBT,John Bean Technologies Corporation Common Stock,$130.71,-1.01,-0.767%,4147323863.00,United States,,155740,Technology,Industrial Machinery/Components
JCE,Nuveen Core Equity Alpha Fund Nuveen Core Equity Alpha Fund Common Shares of Beneficial Interest,$14.62,0.04,0.274%,234348088.00,United States,2007,50179,,
JCI,Johnson Controls International plc Ordinary Share,$52.89,0.85,1.633%,37994658480.00,Switzerland,,4821376,Consumer Services,Other Consumer Services
JCO,Nuveen Credit Opportunities 2022 Target Term Fund Common Shares of Beneficial Interest,$8.27,-0.03,-0.361%,229417516.00,United States,2017,50469,,
JDD,Nuveen Diversified Dividend and Income Fund Shares of Beneficial Interest,$9.02,0.01,0.111%,178023383.00,United States,2003,66916,,
JE,Just Energy Group Inc. Ordinary Shares (Canada),$7.55,0.26,3.567%,362787534.00,Canada,,2622917,Public Utilities,Oil/Gas Transmission
JEF,Jefferies Financial Group Inc. Common Stock,$28.54,0.79,2.847%,7165565484.00,United States,,4624219,Finance,Investment Bankers/Brokers/Service
JELD,JELD-WEN Holding Inc. Common Stock,$28.45,0.25,0.887%,2866385837.00,United States,2017,210789,Basic Industries,Forest Products
JEMD,Nuveen Emerging Markets Debt 2022 Target Term Fund Common Shares of Beneficial Interest $0.01 par value per share,$7.77,-0.03,-0.385%,110685694.00,,2017,13808,,
JEQ,Aberdeen Japan Equity Fund Inc.  Common Stock,$9.73,0.0208,0.214%,130465055.00,United States,1992,6536,,
JFR,Nuveen Floating Rate Income Fund Common Stock,$9.37,-0.07,-0.742%,533326045.00,United States,2004,211780,,
JGH,Nuveen Global High Income Fund Common Shares of Beneficial Interest,$15.58,-0.11,-0.701%,361103783.00,United States,2014,27336,,
JHAA,Nuveen Corporate Income 2023 Target Term Fund,$9.91,0.00,0.00%,77540042.00,,2018,2827,,
JHB,Nuveen Corporate Income November 2021 Target Term Fund,$9.36,0.02,0.214%,523224459.00,,2016,180013,,
JHG,Janus Henderson Group plc Ordinary Shares,$30.79,-0.38,-1.219%,5554613789.00,,2017,1167055,Finance,Investment Managers
JHI,John Hancock Investors Trust Common Stock,$18.20,0.04,0.22%,158467855.00,United States,,8713,,
JHS,John Hancock Income Securities Trust Common Stock,$15.97,0.01,0.063%,185995946.00,United States,,5548,,
JHX,James Hardie Industries plc American Depositary Shares (Ireland),$31.81,0.07,0.221%,14128967825.00,Ireland,,31002,Capital Goods,Building Materials
JIH,Juniper Industrial Holdings Inc. Class A Common Stock,$13.25,-0.30,-2.214%,571406250.00,,2019,744146,Finance,Business Services
JILL,J. Jill Inc. Common Stock,$5.10,-0.36,-6.593%,49061235.00,,2017,470525,Consumer Non-Durables,Apparel
JKS,JinkoSolar Holding Company Limited American Depositary Shares (each representing 4 Common Shares),$64.99,2.14,3.405%,2943647247.00,China,2010,1713436,Technology,Semiconductors
JLL,Jones Lang LaSalle Incorporated Common Stock,$156.74,2.42,1.568%,8041216389.00,United States,,429089,Finance,Real Estate
JLS,Nuveen Mortgage and Income Fund,$20.35,0.06,0.296%,111669404.00,United States,2009,43219,,
JMIA,Jumia Technologies AG American Depositary Shares each representing two Ordinary Shares,$62.79,-2.72,-4.152%,5600656963.00,,2019,4884598,Consumer Services,Catalog/Specialty Distribution
JMM,Nuveen Multi-Market Income Fund (MA),$7.28,0.02,0.275%,68885908.00,United States,,6441,,
JMP,JMP Group LLC Common Shares,$4.80,0.2801,6.197%,94396546.00,United States,2007,56680,Finance,Investment Bankers/Brokers/Service
JNJ,Johnson & Johnson Common Stock,$166.06,-0.75,-0.45%,437160036112.00,United States,,4868085,Health Care,Major Pharmaceuticals
JNPR,Juniper Networks Inc. Common Stock,$25.76,0.32,1.258%,8494008994.00,United States,1999,4708315,Technology,Computer Communications Equipment
JOE,St. Joe Company (The) Common Stock,$54.01,-0.52,-0.954%,3180246471.00,United States,,305970,Consumer Services,Homebuilding
JOF,Japan Smaller Capitalization Fund Inc Common Stock,$9.35,0.05,0.538%,264921900.00,United States,1990,33163,,
JP,Jupai Holdings Limited American Depositary Shares each representing six ordinary shares,$3.21,0.09,2.885%,108222958.00,,2015,147319,Consumer Services,Other Consumer Services
JPC,Nuveen Preferred & Income Opportunities Fund,$9.35,-0.07,-0.743%,966370643.00,United States,2003,265185,,
JPI,Nuveen Preferred and Income Term Fund Common Shares of Beneficial Interest,$24.25,-0.22,-0.899%,551963732.00,,2012,75211,,
JPM,JP Morgan Chase & Co. Common Stock,$139.27,-0.39,-0.279%,424689938000.00,United States,,9197809,Finance,Major Banks
JPM^C,J P Morgan Chase & Co Depositary Shares each representing a 1/400th interest in a share of 6.00% Non-Cumulative  Preferred Stock Series EE,$27.26,-0.09,-0.329%,,United States,,123825,,
JPM^D,J P Morgan Chase & Co Depositary Shares each representing a 1/400th  interest in a share of 5.75% Non-Cumulative  Preferred Stock Series DD,$26.95,-0.09,-0.333%,,United States,,69209,,
JPM^G,J P Morgan Chase & Co Depositary Shares each representing a 1/400th interest in a share of 6.10% Non-Cumulative Preferred Stock Series AA,$25.65,-0.05,-0.195%,,United States,,123795,,
JPM^H,J P Morgan Chase & Co Depositary Shares each representing a 1/400th interest in a share of 6.15% Non-Cumulative Preferred Stock Series BB,$25.52,-0.06,-0.235%,,United States,,88143,Finance,Major Banks
JPM^J,J P Morgan Chase & Co Depositary Shares each representing a 1/400th interest in a share of JPMorgan Chase & Co. 4.75% Non-Cumulative Preferred Stock Series GG,$26.17,-0.17,-0.645%,,United States,,76716,Finance,Major Banks
JPS,Nuveen Preferred & Income Securities Fund,$9.64,-0.06,-0.619%,1964437928.00,United States,2002,251555,,
JPT,Nuveen Preferred and Income 2022 Term Fund Common Shares of Beneficial Interest,$24.42,-0.23,-0.933%,167012776.00,United States,2017,11352,,
JQC,Nuveen Credit Strategies Income Fund Shares of Beneficial Interest,$6.43,-0.09,-1.38%,871967735.00,United States,2003,742395,,
JRI,Nuveen Real Asset Income and Growth Fund Common Shares of Beneficial Interest,$14.17,-0.09,-0.631%,389238281.00,United States,2012,136178,,
JRO,Nuveen Floating Rate Income Opportuntiy Fund Shares of Beneficial Interest,$9.32,-0.07,-0.745%,377844152.00,United States,2004,192899,,
JRS,Nuveen Real Estate Income Fund Common Shares of Beneficial Interest,$9.05,-0.08,-0.876%,261476863.00,United States,2001,76401,,
JSD,Nuveen Short Duration Credit Opportunities Fund Common Shares of Beneficial Interest,$13.75,-0.07,-0.507%,138677660.00,United States,2011,30420,,
JT,Jianpu Technology Inc. American depositary shares,$3.82,0.02,0.526%,80732594.00,,2017,224455,Technology,Computer Software: Programming Data Processing
JTA,Nuveen Tax-Advantaged Total Return Strategy Fund Common Share of Beneficial Interest,$9.97,-0.03,-0.30%,138093443.00,United States,2004,45967,,
JTD,Nuveen Tax-Advantaged Dividend Growth Fund Common Shares of Beneficial Interest,$14.37,0.00,0.00%,208139966.00,United States,,43446,,
JW/A,John Wiley & Sons Inc.,$52.32,0.81,1.573%,,United States,,230305,,
JW/B,John Wiley & Sons Inc.,$51.47,0.00,0.00%,,United States,,92,,
JWN,Nordstrom Inc. Common Stock,$34.52,-0.46,-1.315%,5443235041.00,United States,,2279403,Consumer Services,Clothing/Shoe/Accessory Stores
JWS,Jaws Acquisition Corp. Class A Ordinary Shares,$14.99,0.11,0.739%,1292887500.00,,2020,1177830,Health Care,Medical/Nursing Services
K,Kellogg Company Common Stock,$57.00,-1.11,-1.91%,19591639632.00,United States,,7771688,Consumer Non-Durables,Packaged Foods
KAI,Kadant Inc Common Stock,$146.16,-0.06,-0.041%,1682237290.00,United States,,21164,Technology,Industrial Machinery/Components
KAMN,Kaman Corporation Common Stock,$55.64,0.66,1.20%,1539970147.00,United States,,165924,Capital Goods,Military/Government/Technical
KAR,KAR Auction Services Inc Common Stock,$19.30,0.19,0.994%,2494554954.00,United States,2009,2448333,Consumer Durables,Automotive Aftermarket
KB,KB Financial Group Inc,$40.50,0.11,0.272%,15982690568.00,South Korea,,156004,Finance,Commercial Banks
KBH,KB Home Common Stock,$44.71,1.08,2.475%,4415652954.00,United States,1986,1385041,Capital Goods,Homebuilding
KBR,KBR Inc. Common Stock,$32.30,0.86,2.735%,4603623812.00,United States,2006,1442968,Basic Industries,Military/Government/Technical
KEN,Kenon Holdings Ltd. Ordinary Shares,$30.0998,-0.4752,-1.554%,1621511112.00,Singapore,2015,1113,Public Utilities,Electric Utilities: Central
KEP,Korea Electric Power Corporation Common Stock,$10.98,0.05,0.457%,14097531131.00,South Korea,1994,89775,Public Utilities,Electric Utilities: Central
KEX,Kirby Corporation Common Stock,$60.10,0.94,1.589%,3608343900.00,United States,,487612,Consumer Services,Marine Transportation
KEY,KeyCorp Common Stock,$18.83,-0.13,-0.686%,18373805590.00,United States,,4505395,Finance,Major Banks
KEY^I,KeyCorp Depositary Shares Each Representing a 1/40th Ownership Interest in a Share of Fixed-to-Floating Rate Perpetual Non-Cumulative Preferred Stock Series E,$28.07,-0.11,-0.39%,,United States,,45752,,
KEY^J,KeyCorp Depositary Shares each representing a 1/40th ownership interest in a share of Fixed Rate Perpetual Non-Cumulative Preferred Stock Series F,$26.87,-0.14,-0.518%,,United States,,27672,,
KEY^K,KeyCorp Depositary Shares each representing a 1/40th ownership interest in a share of Fixed Rate Perpetual Non-Cumulative Preferred Stock Series G,$27.25,-0.07,-0.256%,,United States,,55299,,
KEYS,Keysight Technologies Inc. Common Stock,$150.35,1.90,1.28%,27977808334.00,United States,2014,871178,Capital Goods,Industrial Machinery/Components
KF,Korea Fund Inc. (The) New Common Stock,$44.0745,0.2245,0.512%,221748462.00,United States,,2114,,
KFS,Kingsway Financial Services Inc. Common Stock (DE),$4.44,-0.07,-1.552%,100837146.00,Canada,,11357,Finance,Property-Casualty Insurers
KFY,Korn Ferry Common Stock,$56.03,0.15,0.268%,3022141209.00,United States,1999,435451,Technology,Diversified Commercial Services
KGC,Kinross Gold Corporation Common Stock,$7.28,-0.03,-0.41%,9160424000.00,Canada,,19906115,Basic Industries,Precious Metals
KIM,Kimco Realty Corporation Common Stock,$17.95,0.32,1.815%,7763350983.00,United States,,6265371,Consumer Services,Real Estate Investment Trusts
KIM^L,Kimco Realty Corporation Class L Depositary Shares each of which represents a one-one thousandth fractional interest in a share of 5.125% Class L Cumulative Redeemable Preferred Stock liquidation preference $25000.00 per share,$26.03,-0.13,-0.497%,,United States,,110210,,
KIM^M,Kimco Realty Corporation Class M Depositary Shares each of which represents a one-one thousandth fractional interest in a share of 5.25% Class M Cumulative Redeemable Preferred Stock liquidation preference $25000.00 per share,$26.315,-0.015,-0.057%,,United States,,4575,,
KIO,KKR Income Opportunities Fund Common Shares,$15.29,-0.09,-0.585%,311003416.00,,2013,77084,,
KKR,KKR & Co. Inc. Common Stock,$48.21,-0.35,-0.721%,27592708145.00,United States,,4170352,Finance,Investment Managers
KKR^A,KKR & Co. Inc. 6.75% Series A Preferred Stock,$25.82,-0.06,-0.232%,,United States,,11937,,
KKR^B,KKR & Co. Inc. 6.50% Series B Preferred Stock,$25.89,-0.03,-0.116%,,United States,,19310,,
KKR^C,KKR & Co. Inc. 6.00% Series C Mandatory Convertible Preferred Stock,$67.14,-0.68,-1.003%,,United States,,412417,,
KL,Kirkland Lake Gold Ltd. Common Shares,$38.37,-0.84,-2.142%,10245702323.00,,,1553922,Basic Industries,Precious Metals
KMB,Kimberly-Clark Corporation Common Stock,$132.09,-0.71,-0.535%,44738883000.00,United States,,1275485,Consumer Durables,Containers/Packaging
KMF,Kayne Anderson NextGen Energy & Infrastructure Inc.,$6.42,-0.06,-0.926%,303007706.00,,2010,266842,,
KMI,Kinder Morgan Inc. Common Stock,$14.69,-0.10,-0.676%,33264773732.00,United States,2011,11482439,Public Utilities,Natural Gas Distribution
KMPR,Kemper Corporation,$76.09,0.98,1.305%,4979025240.00,United States,,280423,Finance,Property-Casualty Insurers
KMT,Kennametal Inc. Common Stock,$36.51,-1.17,-3.105%,3049789940.00,United States,,677515,Capital Goods,Industrial Machinery/Components
KMX,CarMax Inc,$126.84,1.42,1.132%,20616757645.00,United States,,477506,Consumer Durables,Automotive Aftermarket
KN,Knowles Corporation Common Stock,$20.87,0.32,1.557%,1911933028.00,,2014,755752,Consumer Non-Durables,Consumer Electronics/Appliances
KNL,Knoll Inc. Common Stock,$15.66,-1.04,-6.228%,793680950.00,United States,2004,572037,Consumer Durables,Office Equipment/Supplies/Services
KNOP,KNOT Offshore Partners LP Common Units representing Limited Partner Interests,$16.28,-0.29,-1.75%,532259850.00,United Kingdom,2013,91021,Consumer Services,Marine Transportation
KNX,Knight-Swift Transportation Holdings Inc.,$42.63,-0.15,-0.351%,7239918422.00,United States,2017,1485762,Transportation,Trucking Freight/Courier Services
KO,Coca-Cola Company (The) Common Stock,$50.30,0.70,1.411%,216160960984.00,United States,,21925252,Consumer Non-Durables,Beverages (Production/Distribution)
KODK,Eastman Kodak Company Common New,$11.15,-0.27,-2.364%,860371085.00,United States,,4502336,Miscellaneous,Industrial Machinery/Components
KOF,Coca Cola Femsa S.A.B. de C.V.  American Depositary Shares each representing 10 Units (each Unit consists of 3 Series B Shares and 5 Series L Shares),$44.42,-0.50,-1.113%,9331896899.00,Mexico,1993,98361,Consumer Non-Durables,Beverages (Production/Distribution)
KOP,Koppers Holdings Inc. Koppers Holdings Inc. Common Stock,$36.09,0.34,0.951%,760250900.00,United States,2006,109474,Basic Industries,Forest Products
KOS,Kosmos Energy Ltd. Common Shares (DE),$2.78,-0.10,-3.472%,1127165033.00,Bermuda,2011,6068252,Energy,Oil & Gas Production
KR,Kroger Company (The) Common Stock,$33.40,-0.21,-0.625%,25428991804.00,United States,,6119251,Consumer Services,Food Chains
KRA,Kraton Corporation Common Stock,$35.72,2.09,6.215%,1138464089.00,United States,2009,262090,Basic Industries,Major Chemicals
KRC,Kilroy Realty Corporation Common Stock,$60.93,0.10,0.164%,7070062939.00,United States,1997,838253,Consumer Services,Real Estate Investment Trusts
KREF,KKR Real Estate Finance Trust Inc. Common Stock,$18.63,0.41,2.25%,1036189944.00,United States,2017,439482,Consumer Services,Real Estate Investment Trusts
KRG,Kite Realty Group Trust Common Stock,$17.50,0.05,0.287%,1473562440.00,United States,2004,625178,Consumer Services,Real Estate Investment Trusts
KRO,Kronos Worldwide Inc Common Stock,$14.96,0.01,0.067%,1728519046.00,United States,,143998,Basic Industries,Major Chemicals
KRP,Kimbell Royalty Partners Common Units Representing Limited Partner Interests,$9.46,-0.12,-1.253%,568377215.00,United States,2017,153479,Energy,Oil & Gas Production
KSM,DWS Strategic Municipal Income Trust,$12.11,0.06,0.498%,135679726.00,United States,1989,22790,,
KSS,Kohl's Corporation Common Stock,$50.55,0.57,1.14%,7969328567.00,United States,1992,2395783,Consumer Services,Department/Specialty Retail Stores
KSU,Kansas City Southern Common Stock,$209.36,2.75,1.331%,19019905248.00,United States,,458508,Transportation,Railroads
KSU^,Kansas City Southern Preferred Stock,$39.00,-0.1001,-0.256%,,United States,,50,Transportation,Railroads
KT,KT Corporation Common Stock,$11.26,0.49,4.55%,5355223211.00,South Korea,,2636673,Public Utilities,Telecommunications Equipment
KTB,Kontoor Brands Inc. Common Stock ,$42.88,-0.07,-0.163%,2452966266.00,,2019,314019,Consumer Non-Durables,Apparel
KTF,DWS Municipal Income Trust,$11.82,-0.02,-0.169%,466901087.00,United States,1988,29466,,
KTH,Structures Products Cp 8% CorTS Issued by Peco Energy Cap Tr II Preferred Stock,$33.42,0.32,0.967%,0.00,United States,,1080,Finance,Finance: Consumer Services
KTN,Structured Products Corp 8.205% CorTS 8.205% Corporate Backed Trust Securities (CorTS),$33.00,0.25,0.763%,0.00,United States,,460,Finance,Finance: Consumer Services
KUKE,Kuke Music Holding Limited American Depositary Shares each representing one Ordinary Share,$8.70,-0.22,-2.466%,257230490.00,,2021,58211,Consumer Services,Other Consumer Services
KW,Kennedy-Wilson Holdings Inc. Common Stock,$17.81,-0.04,-0.224%,2524204140.00,United States,,628553,Finance,Real Estate
KWR,Quaker Chemical Corporation Common Stock,$286.66,-0.32,-0.112%,5111599576.00,United States,,70705,Basic Industries,Major Chemicals
KYN,Kayne Anderson Energy Infrastructure Fund Inc.,$6.83,-0.08,-1.158%,863636794.00,United States,2004,469475,,
L,Loews Corporation Common Stock,$48.22,0.23,0.479%,12980824000.00,United States,,471417,Finance,Property-Casualty Insurers
LAC,Lithium Americas Corp. Common Shares,$21.57,0.35,1.649%,2574889738.00,Canada,,5690940,Basic Industries,Precious Metals
LAD,Lithia Motors Inc. Common Stock,$373.79,4.78,1.295%,9914514733.00,United States,,317711,Consumer Durables,Automotive Aftermarket
LADR,Ladder Capital Corp Class A Common Stock,$10.22,0.11,1.088%,1270013411.00,,2014,834605,Consumer Services,Real Estate Investment Trusts
LAIX,LAIX Inc. American Depositary Shares each  representing one Class A Ordinary Share,$3.62,0.08,2.26%,178872283.00,,2018,1521145,Consumer Services,Other Consumer Services
LAZ,Lazard LTD. Lazard LTD. Class A Common Stock,$41.61,0.92,2.261%,4370379980.00,Bermuda,2005,981565,Finance,Investment Managers
LB,L Brands Inc.,$48.25,-0.15,-0.31%,13418738165.00,United States,,1993022,Consumer Services,Clothing/Shoe/Accessory Stores
LBRT,Liberty Oilfield Services Inc. Class A Common Stock,$11.00,-0.21,-1.873%,1974950505.00,United States,2018,1856428,Energy,Oilfield Services/Equipment
LC,LendingClub Corporation Common Stock,$12.21,-0.62,-4.832%,955221194.00,United States,2014,1285328,Finance,Finance: Consumer Services
LCI,Lannett Co Inc Common Stock,$6.51,-0.04,-0.611%,269525262.00,United States,,632119,Health Care,Major Pharmaceuticals
LCII,LCI Industries,$144.23,1.73,1.214%,3627987814.00,United States,,148231,Capital Goods,Auto Parts:O.E.M.
LDI,loanDepot Inc. Class A Common Stock,$22.00,22.00,,0.00,,,7890367,Finance,Finance: Consumer Services
LDL,Lydall Inc. Common Stock,$33.38,-0.05,-0.15%,591941860.00,United States,,80582,Capital Goods,Auto Parts:O.E.M.
LDOS,Leidos Holdings Inc. Common Stock,$109.78,0.43,0.393%,15623997294.00,United States,,541913,Technology,EDP Services
LDP,Cohen & Steers Limited Duration Preferred and Income Fund Inc.,$25.64,-0.08,-0.311%,741259374.00,United States,2012,83331,,
LEA,Lear Corporation Common Stock,$160.18,-1.34,-0.83%,9617012421.00,United States,,443741,Capital Goods,Auto Parts:O.E.M.
LEAF,Leaf Group Ltd. Common Stock,$6.87,-0.37,-5.11%,244618812.00,United States,,328938,Technology,EDP Services
LEAP,Ribbit LEAP Ltd. Class A Ordinary Shares,$14.32,0.57,4.145%,837791600.00,United States,2020,293510,Finance,Business Services
LEE,Lee Enterprises Incorporated Common Stock,$2.28,0.23,11.22%,133983133.00,United States,,2619817,Consumer Services,Newspapers/Magazines
LEG,Leggett & Platt Incorporated Common Stock,$42.88,0.60,1.419%,5682411075.00,United States,,886539,Consumer Durables,Home Furnishings
LEJU,Leju Holdings Limited American Depositary Shares each representing one Ordinary share,$3.16,-0.01,-0.315%,430719654.00,,2014,84887,Finance,Real Estate
LEN,Lennar Corporation Class A Common Stock,$94.56,0.89,0.95%,29567121601.00,United States,,1365902,Basic Industries,Homebuilding
LEO,BNY Mellon Strategic Municipals Inc. Common Stock,$8.71,-0.12,-1.359%,541847027.00,United States,1987,153967,,
LEVI,Levi Strauss & Co Class A Common Stock,$20.92,-0.11,-0.523%,8327411372.00,United States,2019,1076969,Consumer Non-Durables,Apparel
LFC,China Life Insurance Company Limited American Depositary Shares,$10.72,0.16,1.515%,60599538240.00,China,2003,421450,Finance,Life Insurance
LFT,Lument Finance Trust Inc. Common Stock,$3.27,-0.03,-0.909%,81564862.00,United States,2013,64492,Consumer Services,Real Estate Investment Trusts
LGI,Lazard Global Total Return and Income Fund Common Stock,$18.60,0.12,0.649%,241979695.00,United States,2004,16778,,
LGVW,Longview Acquisition Corp. Class A Common Stock,$22.92,0.12,0.526%,1186110000.00,,2020,2106505,Health Care,Medical Electronics
LH,Laboratory Corporation of America Holdings Common Stock,$237.21,8.01,3.495%,23104254000.00,United States,,1181139,Health Care,Medical Specialities
LHX,L3Harris Technologies Inc. Common Stock,$187.50,-0.02,-0.011%,39396006938.00,United States,,1013417,Capital Goods,Industrial Machinery/Components
LII,Lennox International Inc. Common Stock,$291.96,5.27,1.838%,11196440607.00,United States,1999,252547,Capital Goods,Industrial Machinery/Components
LIN,Linde plc Ordinary Share,$253.11,0.39,0.154%,132846477059.00,,2018,1203991,Basic Industries,Major Chemicals
LINX,Linx S.A. American Depositary Shares each representing one common share,$7.11,0.01,0.141%,1249178816.00,,2019,10064,Technology,Computer Software: Prepackaged Software
LITB,LightInTheBox Holding Co. Ltd. American Depositary Shares each representing 2 ordinary shares,$4.08,0.18,4.615%,456044350.00,China,2013,894368,Consumer Services,Catalog/Specialty Distribution
LL,Lumber Liquidators Holdings Inc Common Stock,$28.64,0.06,0.21%,826971666.00,United States,2007,623676,Consumer Services,RETAIL: Building Materials
LLY,Eli Lilly and Company Common Stock,$202.58,-1.81,-0.886%,193784300123.00,United States,,3544650,Health Care,Major Pharmaceuticals
LMND,Lemonade Inc. Common Stock,$160.17,5.40,3.489%,9064105030.00,United States,2020,2799838,Finance,Property-Casualty Insurers
LMT,Lockheed Martin Corporation Common Stock,$339.14,-3.05,-0.891%,94994277589.00,United States,,1181115,Capital Goods,Military/Government/Technical
LNC,Lincoln National Corporation Common Stock,$51.80,-0.57,-1.088%,10011145130.00,United States,,1350032,Finance,Life Insurance
LND,Brasilagro Brazilian Agric Real Estate Co Sponsored ADR (Brazil),$4.45,-0.03,-0.67%,352364016.00,Brazil,,13940,Consumer Non-Durables,Farming/Seeds/Milling
LNFA,L&amp;F Acquisition Corp. Class A Ordinary Shares,$10.27,-0.06,-0.581%,0.00,United States,2021,42731,Finance,Business Services
LNN,Lindsay Corporation Common Stock,$161.98,3.89,2.461%,1759952547.00,United States,,56128,Capital Goods,Industrial Machinery/Components
LOKB,Live Oak Acquisition Corp. II Class A Common Stock,$11.73,0.08,0.687%,370961250.00,,2021,150146,Finance,Business Services
LOMA,Loma Negra Compania Industrial Argentina Sociedad Anonima ADS,$6.03,0.16,2.726%,718807356.00,Argentina,2017,396495,Capital Goods,Building Materials
LOW,Lowe's Companies Inc. Common Stock,$175.73,-1.51,-0.852%,132148960000.00,United States,,2783923,Consumer Services,RETAIL: Building Materials
LPG,Dorian LPG Ltd. Common Stock,$13.67,-0.17,-1.228%,681955153.00,,2014,480560,Transportation,Marine Transportation
LPI,Laredo Petroleum Inc. Common Stock,$32.02,-1.76,-5.21%,384361868.00,United States,2011,360374,Energy,Oil & Gas Production
LPL,LG Display Co Ltd AMERICAN DEPOSITORY SHARES,$10.73,0.11,1.036%,7678724922.00,South Korea,2004,469428,Capital Goods,Industrial Machinery/Components
LPX,Louisiana-Pacific Corporation Common Stock,$42.36,0.21,0.498%,4630957058.00,United States,,975749,Basic Industries,Forest Products
LRN,Stride Inc. Common Stock,$28.45,-0.12,-0.42%,1183589788.00,United States,,482468,Consumer Services,Other Consumer Services
LSI,Life Storage Inc. Common Stock,$84.33,-0.77,-0.905%,6258291129.00,United States,,636100,Consumer Services,Real Estate Investment Trusts
LSPD,Lightspeed POS Inc. Subordinate Voting Shares,$73.40,2.10,2.945%,8724621784.00,,,1039293,Technology,Computer Software: Prepackaged Software
LTC,LTC Properties Inc. Common Stock,$42.27,0.59,1.416%,1658768851.00,United States,,184846,Consumer Services,Real Estate Investment Trusts
LTHM,Livent Corporation Common Stock,$21.87,0.80,3.797%,3199636047.00,United States,2018,3039070,Basic Industries,Major Chemicals
