Symbol,Name,Last Sale,Net Change,% Change,Market Cap,Country,IPO Year,Volume,Sector,Industry
PRU,Prudential Financial Inc. Common Stock,$81.33,-0.78,-0.95%,32239212000.00,United States,2001,2355128,Finance,Life Insurance
PSA,Public Storage Common Stock,$233.07,-1.03,-0.44%,40745796636.00,United States,,853183,Consumer Services,Real Estate Investment Trusts
PSA^C,Public Storage Depositary Shares Each Representing 1/1000 of a 5.125% Cumulative Preferred Share of Beneficial Interest Series C,$25.435,0.035,0.138%,,United States,,29159,Consumer Services,Real Estate Investment Trusts
PSA^D,Public Storage Depositary Shares Each Representing 1/1000 of a 4.95% Cumulative Preferred Share of Beneficial Interest Series D,$25.41,-0.09,-0.353%,,United States,,41838,Consumer Services,Real Estate Investment Trusts
PSA^E,Public Storage Depositary Shares Each Representing 1/1000 of a 4.90% Cumulative Preferred Share of Beneficial Interest Series E,$25.59,-0.01,-0.039%,,United States,,16172,Consumer Services,Real Estate Investment Trusts
PSA^F,Public Storage Depositary Shares Each Representing 1/1000 of a 5.15% Cumulative Preferred Share of Beneficial Interest Series F par value $0.01 per share,$26.07,-0.15,-0.572%,,United States,,16027,Consumer Services,Real Estate Investment Trusts
PSA^G,Public Storage Depositary Shares Each Representing 1/1000 of a 5.05% Cumulative Preferred Share of Beneficial Interest Series G,$26.64,-0.10,-0.374%,,United States,,17543,,
PSA^H,Public Storage Depositary Shares Each Representing 1/1000 of a  5.60% Cumulative Preferred  Share of Beneficial Interest Series H,$27.835,-0.115,-0.411%,,United States,,144315,,
PSA^I,Public Storage Depositary Shares Each Representing 1/1000 of a 4.875% Cumulative Preferred Share of Beneficial Interest Series I par value $0.01 per share,$26.99,0.02,0.074%,,United States,,16464,,
PSA^J,Public Storage Depositary Shares Each Representing 1/1000 of a 4.700% Cumulative Preferred Share of Beneficial Interest Series J par value $0.01 per share,$26.50,-0.16,-0.60%,,United States,,9641,,
PSA^K,Public Storage Depositary Shares Each Representing 1/1000 of a 4.75% Cumulative Preferred Share of Beneficial Interest Series K,$27.22,-0.1699,-0.62%,,United States,,6258,Consumer Services,Real Estate Investment Trusts
PSA^L,Public Storage Depositary Shares Each Representing 1/1000 of a 4.625% Cumulative Preferred Share of Beneficial Interest Series L par value $0.01 per share,$26.44,-0.10,-0.377%,,United States,,38658,Consumer Services,Real Estate Investment Trusts
PSA^M,Public Storage Depositary Shares Each Representing 1/1000 of a 4.125% Cumulative Preferred Share of Beneficial Interest Series M,$26.20,-0.18,-0.682%,,United States,,33088,,
PSA^N,Public Storage Depositary Shares Each Representing 1/1000 of a 3.875% Cumulative Preferred Share of Beneficial Interest Series N,$25.33,-0.02,-0.079%,,United States,,19505,,
PSA^O,Public Storage Depositary Shares Each Representing 1/1000 of a 3.900% Cumulative Preferred Share of Beneficial Interest Series O,$25.87,-0.08,-0.308%,,United States,,29708,,
PSB,PS Business Parks Inc. Common Stock,$143.80,1.27,0.891%,3952853059.00,United States,,104174,Consumer Services,Real Estate Investment Trusts
PSB^W,PS Business Parks Inc. Depositary Shares Each Representing 1/1000 of a Share of 5.20% Cumulative Preferred Stock Series W,$25.64,-0.11,-0.427%,,United States,,26179,,
PSB^X,PS Business Parks Inc. Depositary Shares Each Representing 1/1000 of a Share of 5.25% Cumulative Preferred Stock Series X,$26.2299,0.0699,0.267%,,United States,,8655,,
PSB^Y,PS Business Parks Inc. 5.20% Cumulative Preferred Stock Series Y,$26.06,-0.11,-0.42%,,United States,,8569,,
PSB^Z,PS Business Parks Inc. Depositary Shares Each Representing 1/1000 of a Share of 4.875% Cumulative Preferred Stock Series Z  par value $0.01 per share,$26.31,-0.14,-0.529%,,United States,,11464,,
PSF,Cohen & Steers Select Preferred and Income Fund Inc. Common Stock,$27.53,-0.10,-0.362%,330705144.00,,2010,20433,,
PSN,Parsons Corporation Common Stock,$39.46,0.32,0.818%,3974692116.00,,2019,249471,Technology,EDP Services
PSO,Pearson Plc Common Stock,$10.37,0.15,1.468%,7815748905.00,United Kingdom,,293680,Consumer Services,Books
PSTG,Pure Storage Inc. Class A Common Stock,$28.81,1.11,4.007%,7859684593.00,,2015,5034345,Technology,Electronic Components
PSTH,Pershing Square Tontine Holdings Ltd. Class A Common Stock,$29.99,-0.11,-0.365%,5998002999.00,,2020,2568295,Finance,Business Services
PSTL,Postal Realty Trust Inc. Class A Common Stock,$16.60,-0.25,-1.484%,219353363.00,,2019,72805,Consumer Services,Real Estate Investment Trusts
PSX,Phillips 66 Common Stock,$77.24,0.52,0.678%,33738446289.00,United States,,2307626,Energy,Integrated oil Companies
PSXP,Phillips 66 Partners LP Common Units representing limited partner interest in the Partnership,$25.17,0.03,0.119%,5747321475.00,United States,2013,703275,Energy,Natural Gas Distribution
PTA,Cohen & Steers Tax-Advantaged Preferred Securities and Income Fund Common Shares of Beneficial Interest,$25.25,-0.05,-0.198%,0.00,,2020,95978,,
PTR,PetroChina Company Limited Common Stock,$31.47,-0.14,-0.443%,57596701714.00,China,,76705,Energy,Oil & Gas Production
PTY,Pimco Corporate & Income Opportunity Fund,$17.94,-0.01,-0.056%,1905249797.00,United States,2002,240711,,
PUK,Prudential Public Limited Company Common Stock,$35.72,-0.05,-0.14%,46605988408.00,United Kingdom,,156632,Finance,Life Insurance
PUK^,Prudential Public Limited Company 6.75% Perpetual Subordinated Captial Security,$26.76,-0.14,-0.52%,,United Kingdom,,10961,,
PUK^A,Prudential Public Limited Company 6.50% Perpetual Subordinated Capital Securities Exchangeable at the Issuer's Option Into Non-Cumulative Dollar Denominated Preference Shares,$26.72,0.03,0.112%,,United Kingdom,,17622,,
PUMP,ProPetro Holding Corp. Common Stock,$9.30,-0.42,-4.321%,938488826.00,United States,2017,1034183,Energy,Oilfield Services/Equipment
PVG,Pretium Resources Inc. Ordinary Shares (Canada),$10.72,-0.51,-4.541%,2007360125.00,Canada,,1525756,Basic Industries,Precious Metals
PVH,PVH Corp. Common Stock,$97.72,1.86,1.94%,6947916430.00,United States,,673803,Consumer Non-Durables,Apparel
PVL,Permianville Royalty Trust Trust Units ,$1.36,-0.06,-4.225%,44880000.00,United States,2011,329942,Energy,Oil & Gas Production
PWR,Quanta Services Inc. Common Stock,$77.01,0.79,1.036%,10693677909.00,United States,,876083,Capital Goods,Engineering & Construction
PXD,Pioneer Natural Resources Company Common Stock,$129.87,-2.48,-1.874%,28078814259.00,United States,,1881433,Energy,Oil & Gas Production
PYN,PIMCO New York Municipal Income Fund III Common Shares of Beneficial Interest,$9.34,-0.01,-0.107%,53500370.00,United States,2002,15891,,
PYS,Merrill Lynch Depositor Inc PPlus Tr Ser RRD-1 Tr Ctf Cl A,$21.43,0.03,0.14%,0.00,United States,,106,Finance,Finance: Consumer Services
PYT,PPlus Tr GSC-2 Tr Ctf Fltg Rate,$24.54,-0.26,-1.048%,0.00,United States,,125,Finance,Finance: Consumer Services
PZC,PIMCO California Municipal Income Fund III Common Shares of Beneficial Interest,$10.63,0.05,0.473%,237832814.00,United States,2002,17570,,
PZN,Pzena Investment Management Inc Class A Common Stock,$9.41,-0.34,-3.487%,669709389.00,United States,2007,81868,Finance,Investment Managers
QD,Qudian Inc. American Depositary Shares each representing one Class A Ordinary Share,$3.15,-0.07,-2.174%,799247449.00,China,2017,5762093,Finance,Finance: Consumer Services
QEP,QEP Resources Inc. Common Stock,$3.39,-0.04,-1.166%,823551820.00,United States,,2903018,Energy,Oil & Gas Production
QGEN,Qiagen N.V. Common Shares ,$54.89,-0.11,-0.20%,12556032610.00,Netherlands,,1092636,Health Care,Biotechnology: Biological Products (No Diagnostic Substances)
QS,QuantumScape Corporation Class A Common Stock,$44.97,0.42,0.943%,16367294871.00,United States,2020,6402291,Miscellaneous,Industrial Machinery/Components
QSR,Restaurant Brands International Inc. Common Shares,$59.14,-0.94,-1.565%,17926118137.00,Canada,2014,5108744,Consumer Services,Restaurants
QTS,QTS Realty Trust Inc. Class A Common Stock,$63.97,-1.59,-2.425%,4121939191.00,United States,2013,493421,Consumer Services,Real Estate Investment Trusts
QTS^A,QTS Realty Trust Inc. 7.125% Series A Cumulative Redeemable Perpetual Preferred Stock,$28.00,0.70,2.564%,,United States,,1649,,
QTS^B,QTS Realty Trust Inc. 6.50% Series B Cumulative Convertible Perpetual Preferred Stock,$144.76,-2.68,-1.818%,,United States,,11105,,
QTWO,Q2 Holdings Inc. Common Stock,$144.73,-1.01,-0.693%,7798511049.00,,2014,298508,Technology,Computer Software: Prepackaged Software
QUAD,Quad Graphics Inc Class A Common Stock,$5.87,-0.31,-5.016%,314963714.00,United States,,302007,Miscellaneous,Publishing
QUOT,Quotient Technology Inc. Common Stock,$13.34,3.25,32.21%,1214014144.00,,2014,5919218,Consumer Services,Advertising
QVCC,QVC Inc. 6.250% Senior Secured Notes due 2068,$25.11,-0.19,-0.751%,0.00,United States,2019,48022,Consumer Services,Catalog/Specialty Distribution
QVCD,QVC Inc. 6.375% Senior Secured Notes due 2067,$25.35,-0.03,-0.118%,0.00,United States,2018,11823,Consumer Services,Catalog/Specialty Distribution
R,Ryder System Inc. Common Stock,$65.30,-3.84,-5.554%,3518959732.00,United States,,1035717,Consumer Services,Rental/Leasing Companies
RA,Brookfield Real Assets Income Fund Inc. Common Stock,$19.06,0.08,0.421%,836549366.00,,2016,173656,,
RAAS,Cloopen Group Holding Limited American Depositary Shares each representing two Class A Ordinary Shares,$32.08,1.08,3.484%,5127837256.00,,2021,3470147,Technology,Computer Software: Prepackaged Software
RACE,Ferrari N.V. Common Shares,$204.93,-2.22,-1.072%,50842069823.00,,2015,169231,Capital Goods,Auto Manufacturing
RAD,Rite Aid Corporation Common Stock,$25.81,-1.18,-4.372%,1425340809.00,United States,,2525356,Health Care,Medical/Nursing Services
RAMP,LiveRamp Holdings Inc. Common Stock,$71.12,-0.02,-0.028%,4759308510.00,United States,2018,1091401,Technology,EDP Services
RBA,Ritchie Bros. Auctioneers Incorporated Common Stock,$56.92,-0.07,-0.123%,6244825368.00,Canada,,834170,Miscellaneous,Business Services
RBAC,RedBall Acquisition Corp. Class A Ordinary Shares,$10.77,-0.03,-0.278%,774093750.00,United States,2020,609068,Finance,Business Services
RBC,Regal Beloit Corporation Common Stock,$129.97,1.76,1.373%,5276168802.00,United States,,261348,Consumer Durables,Metal Fabrications
RC,Ready Capital Corproation Common Stock,$12.79,0.10,0.788%,706533388.00,United States,2013,426366,Consumer Services,Real Estate Investment Trusts
RCA,Ready Capital Corporation 7.00% Convertible Senior Notes due 2023,$25.36,0.01,0.039%,0.00,United States,2017,53341,Consumer Services,Real Estate Investment Trusts
RCB,Ready Capital Corporation 6.20% Senior Notes due 2026,$25.455,0.025,0.098%,0.00,United States,2019,39202,Consumer Services,Real Estate Investment Trusts
RCI,Rogers Communication Inc. Common Stock,$45.48,-0.47,-1.023%,22964003463.00,Canada,,644635,Consumer Services,Television Services
RCL,D/B/A Royal Caribbean Cruises Ltd. Common Stock,$67.99,-0.78,-1.134%,16139822876.00,United States,1993,3255209,Consumer Services,Marine Transportation
RCP,Ready Capital Corporation 6.50% Senior Notes due 2021,$25.19,0.0124,0.049%,0.00,United States,2018,17234,Consumer Services,Real Estate Investment Trusts
RCS,PIMCO Strategic Income Fund Inc.,$7.11,-0.03,-0.42%,312384960.00,United States,1994,145316,,
RCUS,Arcus Biosciences Inc. Common Stock,$37.00,-1.50,-3.896%,2402162248.00,,2018,453926,Health Care,Major Pharmaceuticals
RDN,Radian Group Inc. Common Stock,$20.62,-0.20,-0.961%,3949896432.00,United States,,910115,Finance,Property-Casualty Insurers
RDS/B,Royal Dutch Shell PLC,$35.41,-0.73,-2.02%,,Netherlands,,2962960,,
RDY,Dr. Reddy's Laboratories Ltd Common Stock,$66.18,0.46,0.70%,10981684982.00,India,,126656,Health Care,Major Pharmaceuticals
RE,Everest Re Group Ltd. Common Stock,$244.95,10.26,4.372%,9789591601.00,Bermuda,,365543,Finance,Property-Casualty Insurers
RELX,RELX PLC PLC American Depositary Shares (Each representing One Ordinary Share),$25.30,0.56,2.264%,48887761805.00,United Kingdom,2015,547329,Miscellaneous,Business Services
RENN,Renren Inc. American Depositary Shares each representing fifteen Class A ordinary shares,$8.14,1.10,15.625%,191939914.00,China,2011,283972,Consumer Durables,Automotive Aftermarket
RES,RPC Inc. Common Stock,$4.78,-0.34,-6.641%,1028022999.00,United States,,1197287,Energy,Oilfield Services/Equipment
REV,Revlon Inc. New Common Stock,$11.23,0.07,0.627%,598930421.00,United States,1996,244481,Consumer Non-Durables,Package Goods/Cosmetics
REVG,REV Group Inc. Common Stock,$11.50,0.21,1.86%,733868326.00,United States,2017,201964,Capital Goods,Auto Manufacturing
REX,REX American Resources Corporation,$95.42,0.26,0.273%,571756831.00,United States,,19557,Basic Industries,Major Chemicals
REXR,Rexford Industrial Realty Inc. Common Stock,$50.76,0.38,0.754%,6625474431.00,United States,2013,957707,Consumer Services,Real Estate Investment Trusts
REXR^B,Rexford Industrial Realty Inc. 5.875% Series B Cumulative Redeemable Preferred Stock,$26.90,0.00,0.00%,,United States,,1039,,
REXR^C,Rexford Industrial Realty Inc. 5.625% Series C Cumulative Redeemable Preferred Stock par value $0.01 per share,$26.90,0.0601,0.224%,,United States,,85069,,
REZI,Resideo Technologies Inc. Common Stock ,$25.94,-0.01,-0.039%,3710585199.00,,2018,724815,Capital Goods,Wholesale Distributors
RF,Regions Financial Corporation Common Stock,$19.34,-0.14,-0.719%,18574984504.00,United States,,5560468,Finance,Major Banks
RF^A,Regions Financial Corporation Depositary Shares Representing 1/40th Perpetual Preferred Series A,$25.90,-0.155,-0.595%,,United States,,24088,,
RF^B,Regions Financial Corporation Depositary Shares Representing 1/40th Perpetual Preferred Series B,$28.43,-0.02,-0.07%,,United States,,55174,,
RF^C,Regions Financial Corporation Depositary Shares each Representing a 1/40th Interest in a  Share of 5.700% Fixed-to-Floating Rate Non-Cumulative  Perpetual Preferred Stock Series C,$28.35,-0.165,-0.579%,,United States,,21803,,
RFI,Cohen & Steers Total Return Realty Fund Inc. Common Stock,$14.01,-0.13,-0.919%,367308744.00,United States,1993,66038,,
RFL,Rafael Holdings Inc. Class B Common Stock,$30.11,0.96,3.293%,494497885.00,United States,2018,53668,Finance,Real Estate
RFM,RiverNorth Flexible Municipal Income Fund Inc. Common Stock,$22.60,-0.15,-0.659%,0.00,,2020,11413,,
RFP,Resolute Forest Products Inc. Common Stock,$9.92,0.67,7.243%,808814612.00,Canada,,664224,Basic Industries,Paper
RGA,Reinsurance Group of America Incorporated Common Stock,$112.71,0.81,0.724%,7659433470.00,United States,,341395,Finance,Life Insurance
RGR,Sturm Ruger & Company Inc. Common Stock,$68.24,0.42,0.619%,1193920216.00,United States,,187789,Capital Goods,Ordnance And Accessories
RGS,Regis Corporation Common Stock,$10.48,-0.12,-1.132%,406201300.00,United States,1991,246674,Consumer Services,Other Consumer Services
RGT,Royce Global Value Trust Inc. Common Stock,$13.88,0.01,0.072%,145788164.00,,2013,18482,,
RH,RH Common Stock,$506.08,8.06,1.618%,10324756200.00,United States,2012,556000,Consumer Services,Other Specialty Stores
RHI,Robert Half International Inc. Common Stock,$73.06,0.05,0.068%,8327381357.00,United States,,823606,Technology,Professional Services
RHP,Ryman Hospitality Properties Inc. (REIT),$71.22,0.74,1.05%,3915769112.00,United States,,310956,Consumer Services,Real Estate Investment Trusts
RICE,Rice Acquisition Corp. Class A Common Stock,$11.81,-0.25,-2.073%,353223519.00,United States,2020,35458,Finance,Business Services
RIG,Transocean Ltd (Switzerland) Common Stock,$3.46,-0.19,-5.205%,2128281645.00,Switzerland,,19252340,Energy,Oil & Gas Production
RIO,Rio Tinto Plc Common Stock,$82.28,-0.78,-0.939%,102601817684.00,Australia,2002,1812324,Basic Industries,Precious Metals
RIV,RiverNorth Opportunities Fund Inc. Common Stock,$17.17,-0.03,-0.174%,161226300.00,,2015,71692,,
RJF,Raymond James Financial Inc. Common Stock,$113.45,0.75,0.665%,15623330194.00,United States,,591071,Finance,Investment Bankers/Brokers/Service
RKT,Rocket Companies Inc. Class A Common Stock,$20.67,-0.27,-1.289%,41018623832.00,United States,2020,7581174,Finance,Finance: Consumer Services
RL,Ralph Lauren Corporation Common Stock,$113.44,1.28,1.141%,8294547439.00,United States,1997,890543,Consumer Non-Durables,Apparel
RLGY,Realogy Holdings Corp. Common Stock,$18.02,1.15,6.817%,2080532329.00,United States,2012,1831072,Finance,Real Estate
RLH,Red Lions Hotels Corporation Common Stock,$3.42,-0.01,-0.292%,87214292.00,United States,,79635,Consumer Services,Hotels/Resorts
RLI,RLI Corp. Common Stock (DE),$105.18,1.25,1.203%,4738902150.00,United States,,121800,Finance,Property-Casualty Insurers
RLJ,RLJ Lodging Trust Common Shares of Beneficial Interest $0.01 par value,$14.09,0.21,1.513%,2325157782.00,United States,2011,924522,Consumer Services,Real Estate Investment Trusts
RLJ^A,RLJ Lodging Trust $1.95 Series A Cumulative Convertible  Preferred Shares,$26.16,-0.19,-0.721%,,United States,,9671,,
RLX,RLX Technology Inc. American Depositary Shares each representing the right to receive one (1) Class A ordinary share,$24.95,2.52,11.235%,38755223472.00,,2021,8265122,Consumer Non-Durables,Farming/Seeds/Milling
RM,Regional Management Corp. Common Stock,$33.07,1.45,4.586%,374874278.00,United States,2012,53257,Finance,Finance: Consumer Services
RMAX,RE/MAX Holdings Inc. Class A Common Stock,$40.39,1.26,3.22%,1256807592.00,,2013,71674,Finance,Real Estate
RMD,ResMed Inc. Common Stock,$200.53,0.13,0.065%,29178936615.00,United States,,840545,Health Care,Medical/Dental Instruments
RMI,RiverNorth Opportunistic Municipal Income Fund Inc. Common Stock,$22.05,-0.045,-0.204%,140530559.00,,2018,12206,,
RMM,RiverNorth Managed Duration Municipal Income Fund Inc. Common Stock,$18.90,-0.03,-0.158%,373076871.00,,2019,42435,,
RMO,Romeo Power Inc. Class A Common Stock,$17.71,-0.43,-2.37%,2245400444.00,,2019,4440479,Capital Goods,Auto Parts:O.E.M.
RMPL^,RiverNorth Specialty Finance Corporation 5.875% ,$25.26,0.0311,0.123%,,,,900,,
RMT,Royce Micro-Cap Trust Inc. Common Stock,$12.06,0.00,0.00%,519773084.00,United States,,140865,,
RNG,RingCentral Inc. Class A Common Stock,$432.04,2.29,0.533%,38724482692.00,,2013,533088,Technology,EDP Services
RNGR,Ranger Energy Services Inc. Class A Common Stock,$5.39,0.05,0.936%,82978597.00,United States,2017,9007,Energy,Oilfield Services/Equipment
RNP,Cohen & Steers REIT and Preferred and Income Fund Inc. Common Shares,$23.45,0.06,0.257%,1115802426.00,United States,2003,82924,,
RNR,RenaissanceRe Holdings Ltd. Common Stock,$162.55,3.73,2.349%,8243645226.00,Bermuda,,327289,Finance,Property-Casualty Insurers
RNR^E,RenaissanceRe Holdings Ltd. 5.375% Series E Preference Shares,$25.42,0.06,0.237%,,Bermuda,,12424,,
RNR^F,RenaissanceRe Holdings Ltd. Depositary Shares each Representing a 1/1000th Interest in a 5.750% Series F Preference Share,$27.77,-0.07,-0.251%,,Bermuda,,9601,,
ROG,Rogers Corporation Common Stock,$180.80,4.38,2.483%,3376584278.00,United States,,58882,Basic Industries,Major Chemicals
ROK,Rockwell Automation Inc. Common Stock,$246.86,2.11,0.862%,28674043296.00,United States,,633366,Capital Goods,Industrial Machinery/Components
ROL,Rollins Inc. Common Stock,$37.65,-0.28,-0.738%,18509625264.00,United States,,1278449,Finance,Diversified Commercial Services
ROP,Roper Technologies Inc. Common Stock,$400.01,-1.84,-0.458%,41949993124.00,United States,1992,341032,Capital Goods,Industrial Machinery/Components
RPAI,Retail Properties of America Inc. Class A Common Stock,$10.58,0.19,1.829%,2266792794.00,United States,2012,2876369,Consumer Services,Real Estate Investment Trusts
RPLA,Replay Acquisition Corp. Ordinary Shares,$10.19,0.01,0.098%,366203125.00,,2019,296347,Finance,Business Services
RPM,RPM International Inc. Common Stock,$86.85,0.59,0.684%,11299426877.00,United States,,395143,Basic Industries,Paints/Coatings
RPT,RPT Realty Common Stock,$10.45,0.29,2.854%,846051897.00,United States,,423595,Consumer Services,Real Estate Investment Trusts
RPT^D,RPT Realty 7.25% ,$51.8624,0.1574,0.304%,,United States,,4769,,
RQI,Cohen & Steers Quality Income Realty Fund Inc Common Shares,$13.00,0.00,0.00%,1745161977.00,United States,2002,254450,,
RRC,Range Resources Corporation Common Stock,$9.57,-0.62,-6.084%,2453109920.00,United States,,6605614,Energy,Oil & Gas Production
RRD,R.R. Donnelley & Sons Company Common Stock,$2.56,-0.02,-0.775%,182784000.00,United States,,514879,Miscellaneous,Publishing
RS,Reliance Steel & Aluminum Co. Common Stock (DE),$124.34,0.49,0.396%,7927456726.00,United States,1994,230233,Basic Industries,Metal Fabrications
RSF,RiverNorth Specialty Finance Corporation,$17.245,0.055,0.32%,94265740.00,,2019,8284,,
RSG,Republic Services Inc. Common Stock,$91.29,0.77,0.851%,29096376494.00,United States,1998,1223457,Public Utilities,Environmental Services
RSI,Rush Street Interactive Inc. Class A Common Stock,$19.85,-0.42,-2.072%,4065131462.00,,2020,751552,Consumer Services,Services-Misc. Amusement & Recreation
RTP,Reinvent Technology Partners Class A Ordinary Shares,$13.64,0.21,1.564%,1176450000.00,United States,2020,2283991,Finance,Business Services
RTPZ,Reinvent Technology Partners Z Class A Ordinary Shares,$12.57,0.15,1.208%,361387500.00,United States,2021,452749,Finance,Business Services
RTX,Raytheon Technologies Corporation Common Stock,$72.33,-0.14,-0.193%,109903853432.00,United States,,4534565,Capital Goods,Aerospace
RVI,Retail Value Inc. Common Stock ,$17.52,-0.38,-2.123%,347408705.00,United States,2018,56560,Finance,Real Estate
RVLV,Revolve Group Inc. Class A Common Stock,$38.61,0.14,0.364%,2711043274.00,,2019,467917,Consumer Services,Catalog/Specialty Distribution
RVT,Royce Value Trust Inc. Common Stock,$18.12,0.10,0.555%,1820547222.00,United States,1986,259543,,
RWT,Redwood Trust Inc. Common Stock,$9.92,0.22,2.268%,1110325958.00,United States,1995,2187456,Consumer Services,Real Estate Investment Trusts
RXN,Rexnord Corporation Common Stock,$41.17,0.26,0.636%,4951921383.00,United States,2012,425362,Technology,Industrial Machinery/Components
RY,Royal Bank Of Canada Common Stock,$83.29,-0.10,-0.12%,118527145401.00,Canada,,1570664,Finance,Commercial Banks
RY^T,Royal Bank Of Canada 6.750% Fixed Rate/Floating Rate Noncumulative First Preferred Shares Series C-2,$28.51,0.01,0.035%,,Canada,,700,,
RYAM,Rayonier Advanced Materials Inc. Common Stock,$8.85,0.05,0.568%,560602958.00,United States,2014,462177,Basic Industries,Paper
RYB,RYB Education Inc. American depositary shares each representing one Class A ordinary share,$3.10,-0.07,-2.208%,85517673.00,,2017,139085,Consumer Services,Other Consumer Services
RYI,Ryerson Holding Corporation Common Stock,$13.14,-0.21,-1.573%,500862597.00,United States,2014,119543,Basic Industries,Metal Fabrications
RYN,Rayonier Inc. REIT Common Stock,$34.52,0.31,0.906%,4752672935.00,United States,,435226,Consumer Services,Real Estate Investment Trusts
RZA,Reinsurance Group of America Incorporated 6.20% Fixed-to-Floating Rate Subordinated Debentures due 2042,$26.80,-0.13,-0.483%,0.00,United States,,18920,Finance,Life Insurance
RZB,Reinsurance Group of America Incorporated 5.75% Fixed-To-Floating Rate Subordinated Debentures due 2056,$28.88,-0.10,-0.345%,0.00,United States,2016,15350,Finance,Life Insurance
SA,Seabridge Gold Inc. Ordinary Shares (Canada),$18.76,-0.28,-1.471%,1391440831.00,Canada,,355622,Basic Industries,Precious Metals
SAF,Saratoga Investment Corp 6.25% Notes due 2023,$25.54,-0.168,-0.653%,0.00,United States,2018,5599,,
SAFE,Safehold Inc. Common Stock,$80.87,0.00,0.00%,4293036516.00,United States,2017,108417,Consumer Services,Real Estate
SAH,Sonic Automotive Inc. Common Stock,$47.36,0.56,1.197%,1991486390.00,United States,1997,317353,Consumer Durables,Automotive Aftermarket
SAIC,SCIENCE APPLICATIONS INTERNATIONAL CORPORATION Common Stock,$97.84,0.98,1.012%,5696667860.00,,,433147,Technology,EDP Services
SAIL,SailPoint Technologies Holdings Inc. Common Stock,$62.96,1.77,2.893%,5723848419.00,United States,2017,1006350,Technology,Computer Software: Prepackaged Software
SAK,Saratoga Investment Corp 7.25% Notes due 2025,$26.28,-0.255,-0.961%,0.00,United States,2020,16539,,
SAM,Boston Beer Company Inc. (The) Common Stock,$1124.96,-3.36,-0.298%,13772444296.00,United States,,48432,Consumer Non-Durables,Beverages (Production/Distribution)
SAN,Banco Santander S.A. Sponsored ADR (Spain),$3.43,-0.01,-0.291%,59381966650.00,Spain,,9731599,Finance,Commercial Banks
SAND          ,Sandstorm Gold Ltd. Ordinary Shares (Canada),$6.44,-0.19,-2.866%,1238807525.00,Canada,,2024940,Basic Industries,Precious Metals
SAP,SAP  SE ADS,$132.52,2.85,2.198%,158182481833.00,Germany,,781988,Technology,Computer Software: Prepackaged Software
SAR,Saratoga Investment Corp New,$24.20,0.49,2.067%,270314678.00,United States,,63114,,
SAVE,Spirit Airlines Inc. Common Stock,$30.01,-2.67,-8.17%,2931324733.00,United States,,13003437,Transportation,Air Freight/Delivery Services
SB,Safe Bulkers Inc Common Stock ($0.001 par value),$2.49,0.22,9.692%,254414739.00,Monaco,2008,962178,Transportation,Marine Transportation
SB^C,Safe Bulkers Inc Cumulative Redeemable Perpetual Preferred Series C (Marshall Islands),$21.89,-0.01,-0.046%,,Monaco,,1097,,
SB^D,Safe Bulkers Inc Perpetual Preferred Series D (Marshall Islands),$22.0299,0.0599,0.273%,,Monaco,,6176,,
SBBA,Scorpio Tankers Inc. 7.00% Senior Notes due 2025,$25.12,0.02,0.08%,0.00,Monaco,2020,11433,Transportation,Marine Transportation
SBE,Switchback Energy Acquisition Corporation Class A Common Stock,$37.15,-2.15,-5.471%,1458683754.00,,2019,5154150,Capital Goods,Industrial Specialties
SBG,Sandbridge Acquisition Corporation Class A Common Stock,$10.56,0.06,0.571%,303600000.00,,2020,66934,Finance,Business Services
