Symbol,Name,Last Sale,Net Change,% Change,Market Cap,Country,IPO Year,Volume,Sector,Industry
CUK,Carnival Plc ADS ADS,$17.99,-0.12,-0.663%,20040217415.00,United States,,1021131,Consumer Services,Marine Transportation
CULP,Culp Inc. Common Stock,$16.37,0.07,0.429%,201413124.00,United States,,34981,Basic Industries,Textiles
CURO,CURO Group Holdings Corp. Common Stock,$15.39,-0.31,-1.975%,629221889.00,,2017,525465,Finance,Finance: Consumer Services
CUZ,Cousins Properties Incorporated Common Stock,$34.20,0.24,0.707%,5080900975.00,United States,,1030038,Consumer Services,Real Estate Investment Trusts
CVA,Covanta Holding Corporation Common Stock,$15.22,0.37,2.492%,2008762616.00,United States,,1870309,Basic Industries,Electric Utilities: Central
CVE,Cenovus Energy Inc Common Stock,$6.56,-0.12,-1.796%,13234064663.00,Canada,,8038347,Energy,Oil & Gas Production
CVEO,Civeo Corporation (Canada) Common Shares,$19.00,0.35,1.877%,270088211.00,,2014,40522,Consumer Services,Hotels/Resorts
CVI,CVR Energy Inc. Common Stock,$19.15,0.11,0.578%,1925160971.00,United States,2007,588033,Energy,Integrated oil Companies
CVNA,Carvana Co. Class A Common Stock,$294.34,-3.59,-1.205%,50561434981.00,United States,2017,801316,Consumer Durables,Automotive Aftermarket
CVS,CVS Health Corporation Common Stock,$73.60,-0.23,-0.312%,96336033453.00,United States,,4723807,Health Care,Medical/Nursing Services
CVX,Chevron Corporation Common Stock,$92.02,-0.50,-0.54%,177139437960.00,United States,,8571192,Energy,Integrated oil Companies
CW,Curtiss-Wright Corporation Common Stock,$115.70,2.11,1.858%,4801784408.00,United States,,175825,Technology,Industrial Machinery/Components
CWEN,Clearway Energy Inc. Class C Common Stock,$32.12,-0.26,-0.803%,6476547999.00,United States,2015,379308,Public Utilities,Electric Utilities: Central
CWH,Camping World Holdings Inc. Class A Commom Stock,$38.65,0.05,0.13%,3430436947.00,United States,2016,1984110,Consumer Durables,Automotive Aftermarket
CWK,Cushman & Wakefield plc Ordinary Shares,$15.95,0.30,1.917%,3534991434.00,,2018,390833,Finance,Real Estate
CWT,California Water Service Group Common Stock,$60.27,0.46,0.769%,3003856800.00,United States,,176809,Public Utilities,Water Supply
CX,Cemex S.A.B. de C.V. Sponsored ADR,$6.67,0.29,4.545%,10076456604.00,Mexico,,20415542,Capital Goods,Building Materials
CXE,MFS High Income Municipal Trust Common Stock,$5.21,-0.01,-0.192%,164227270.00,United States,1989,49826,,
CXH,MFS Investment Grade Municipal Trust Common Stock,$10.07,-0.01,-0.099%,91740167.00,United States,1989,11729,,
CXP,Columbia Property Trust Inc. Common Stock,$14.27,0.03,0.211%,1633415636.00,United States,2013,810967,Consumer Services,Real Estate Investment Trusts
CXW,CoreCivic Inc. Common Stock,$7.62,-0.23,-2.93%,911612726.00,United States,,2440048,Consumer Services,Real Estate Investment Trusts
CYD,China Yuchai International Limited Common Stock,$17.11,-0.29,-1.667%,699085359.00,Singapore,1994,35304,Energy,Industrial Machinery/Components
CYH,Community Health Systems Inc. Common Stock,$9.25,-0.11,-1.175%,1106493806.00,United States,2000,947309,Health Care,Hospital/Nursing Management
CZZ,Cosan Limited Class A Common Stock,$20.42,0.97,4.987%,4562151330.00,Brazil,,690377,Consumer Non-Durables,Specialty Foods
D,Dominion Energy Inc. Common Stock,$73.06,-0.03,-0.041%,59603743081.00,United States,,2751063,Public Utilities,Electric Utilities: Central
DAC,Danaos Corporation Common Stock,$34.29,-1.55,-4.325%,701231906.00,Greece,2006,581725,Transportation,Marine Transportation
DAL,Delta Air Lines Inc. Common Stock,$42.72,-0.18,-0.42%,27244009339.00,United States,,8536607,Transportation,Air Freight/Delivery Services
DAN,Dana Incorporated Common Stock ,$22.51,-0.46,-2.003%,3252497182.00,United States,,1191754,Capital Goods,Auto Parts:O.E.M.
DAO,Youdao Inc. American Depositary Shares each representing one Class A Ordinary Share,$33.50,-1.64,-4.667%,3744219826.00,,2019,3603645,Consumer Services,Other Consumer Services
DAR,Darling Ingredients Inc. Common Stock,$70.29,1.39,2.017%,11391793740.00,United States,,1136715,Consumer Non-Durables,Packaged Foods
DASH,DoorDash Inc. Class A Common Stock,$213.26,-1.90,-0.883%,67743429668.00,,2020,1947621,Miscellaneous,Business Services
DAVA,Endava plc American Depositary Shares (each representing one Class A Ordinary Share),$85.74,3.24,3.927%,4725761160.00,,2018,177409,Technology,EDP Services
DB,Deutsche Bank AG Common Stock,$10.68,0.09,0.85%,22048573039.00,Germany,,1684603,Finance,Major Banks
DBD,Diebold Nixdorf Incorporated Common Stock,$13.64,-0.02,-0.146%,1059533690.00,United States,,1041594,Miscellaneous,Office Equipment/Supplies/Services
DBI,Designer Brands Inc. Class A Common Stock,$12.22,0.13,1.075%,884640957.00,United States,,1143352,Consumer Services,Clothing/Shoe/Accessory Stores
DBL,DoubleLine Opportunistic Credit Fund Common Shares of Beneficial Interest,$19.81,-0.14,-0.702%,296296110.00,United States,2012,14801,,
DCF,BNY Mellon Alcentra Global Credit Income 2024 Target Term Fund Inc. Common Stock,$9.03,0.03,0.333%,135117082.00,,2017,39768,,
DCI,Donaldson Company Inc. Common Stock,$61.79,0.46,0.75%,7800364595.00,United States,,442197,Capital Goods,Pollution Control Equipment
DCO,Ducommun Incorporated Common Stock,$56.12,-0.40,-0.708%,657422791.00,United States,,33390,Capital Goods,Military/Government/Technical
DCP,DCP Midstream  LP Common Units ,$20.86,-0.06,-0.287%,4346212874.00,United States,,2392981,Public Utilities,Natural Gas Distribution
DCP^B,DCP Midstream LP 7.875% Series B Fixed-to-Floating Rate Cumulative Redeemable Perpetual Preferred Units,$22.24,-0.62,-2.712%,,United States,,14278,,
DCP^C,DCP Midstream LP 7.95% Series C Fixed-to-Floating Rate Cumulative Redeemable Perpetual Preferred Units,$22.05,0.02,0.091%,,United States,,10814,,
DCUE,Dominion Energy Inc. 2019 Series A Corporate Units,$98.80,0.00,0.00%,0.00,United States,2019,14306,Public Utilities,Electric Utilities: Central
DD,DuPont de Nemours Inc. Common Stock,$70.96,0.64,0.91%,38065746352.00,,2017,8972109,Basic Industries,Major Chemicals
DDD,3D Systems Corporation Common Stock,$49.94,-1.54,-2.991%,6199648234.00,United States,,6139782,Technology,Computer Software: Prepackaged Software
DDF,Delaware Investments Dividend & Income Fund Inc. Common Stock,$9.72,0.00,0.00%,73980465.00,United States,1993,8573,,
DDS,Dillard's Inc. Common Stock,$80.25,-0.71,-0.877%,1765330833.00,United States,,536236,Consumer Services,Department/Specialty Retail Stores
DDT,Dillard's Capital Trust I,$25.6795,-0.0105,-0.041%,0.00,United States,,9534,Consumer Services,Department/Specialty Retail Stores
DE,Deere & Company Common Stock,$314.46,0.82,0.261%,98872935834.00,United States,,995112,Capital Goods,Industrial Machinery/Components
DEA,Easterly Government Properties Inc. Common Stock,$22.79,0.11,0.485%,1851262808.00,United States,2015,1205562,Consumer Services,Real Estate Investment Trusts
DECK,Deckers Outdoor Corporation Common Stock,$319.44,-1.37,-0.427%,8998599245.00,United States,1993,300224,Consumer Non-Durables,Shoe Manufacturing
DEH,D8 Holdings Corp. Class A Ordinary Shares,$10.50,0.06,0.575%,452812500.00,Hong Kong,2020,55867,Finance,Business Services
DEI,Douglas Emmett Inc. Common Stock,$29.72,0.12,0.405%,5212141612.00,United States,2006,1249161,Consumer Services,Real Estate Investment Trusts
DELL,Dell Technologies Inc. Class C Common Stock ,$79.50,-0.08,-0.101%,59609448051.00,,2018,1559570,Technology,Computer Manufacturing
DEN,Denbury Inc. Common Stock,$36.24,1.13,3.218%,1811999964.00,,2020,594614,Energy,Oil & Gas Production
DEO,Diageo plc Common Stock,$167.12,2.24,1.359%,97753091153.00,United Kingdom,,779503,Consumer Non-Durables,Beverages (Production/Distribution)
DESP,Despegar.com Corp. Ordinary Shares,$12.27,0.20,1.657%,858237420.00,,2017,177503,Consumer Services,Transportation Services
DEX,Delaware Enhanced Global Dividend Common Shares of Beneficial Interest,$9.79,0.04,0.41%,116486305.00,United States,2007,52363,,
DFIN,Donnelley Financial Solutions Inc. Common Stock ,$23.00,1.40,6.481%,767633510.00,,2016,378505,Consumer Services,Other Consumer Services
DFNS,LGL Systems Acquisition Corp. Common Stock,$10.97,-0.18,-1.614%,236540625.00,United States,2020,105054,Finance,Business Services
DFP,Flaherty & Crumrine Dynamic Preferred and Income Fund Inc. Common Stock,$29.94,0.26,0.876%,574002464.00,,2013,36715,,
DFS,Discover Financial Services Common Stock,$92.77,-0.60,-0.643%,28480390000.00,United States,,1187341,Finance,Finance: Consumer Services
DG,Dollar General Corporation Common Stock,$200.04,-1.28,-0.636%,49009980636.00,United States,2009,1495751,Consumer Services,Department/Specialty Retail Stores
DGNR,Dragoneer Growth Opportunities Corp. Class A Ordinary Shares,$12.06,0.12,1.005%,1040175000.00,United States,2020,490001,Finance,Business Services
DGX,Quest Diagnostics Incorporated Common Stock,$125.06,1.51,1.222%,16632980000.00,United States,,1387999,Health Care,Medical Specialities
DHF,BNY Mellon High Yield Strategies Fund Common Stock,$3.06,0.01,0.328%,222485525.00,United States,1998,3414621,,
DHI,D.R. Horton Inc. Common Stock,$83.45,0.89,1.078%,30350907866.00,United States,,1666024,Capital Goods,Homebuilding
DHR,Danaher Corporation Common Stock,$240.66,3.17,1.335%,171109260000.00,United States,,1849282,Capital Goods,Industrial Machinery/Components
DHR^A,Danaher Corporation 4.75% Mandatory Convertible Preferred Stock Series A,$1637.56,15.54,0.958%,,United States,,15081,,
DHR^B,Danaher Corporation 5.00% Mandatory Convertible Preferred Stock Series B,$1370.55,0.56,0.041%,,United States,,41155,,
DHT,DHT Holdings Inc.,$5.82,-0.18,-3.00%,994046269.00,Jersey,2005,3609669,Transportation,Marine Transportation
DHX,DHI Group Inc. Common Stock,$2.79,0.18,6.897%,146300084.00,United States,2007,170111,Miscellaneous,Business Services
DIAX,Nuveen Dow 30SM Dynamic Overwrite Fund Common Shares of Beneficial Interest,$15.09,-0.02,-0.132%,548776717.00,,2014,129040,,
DIN,Dine Brands Global Inc. Common Stock,$75.80,-2.22,-2.845%,1244541174.00,United States,,544804,Consumer Services,Restaurants
DIS,Walt Disney Company (The) Common Stock,$190.91,1.28,0.675%,346361103585.00,United States,,17320454,Consumer Services,Services-Misc. Amusement & Recreation
DK,Delek US Holdings Inc. Common Stock,$21.52,-0.28,-1.284%,1586578312.00,United States,2017,490983,Energy,Integrated oil Companies
DKL,Delek Logistics Partners L.P. Common Units representing Limited Partner Interests,$39.87,0.15,0.378%,1731683239.00,United States,2012,40402,Energy,Natural Gas Distribution
DKS,Dick's Sporting Goods Inc Common Stock,$76.19,-1.51,-1.943%,6826523048.00,United States,2002,1629714,Consumer Services,Other Specialty Stores
DL,China Distance Education Holdings Limited American Depositary Shares,$9.65,-0.02,-0.207%,326460542.00,China,,16489,Consumer Services,Other Consumer Services
DLB,Dolby Laboratories Common Stock,$93.35,0.18,0.193%,9485570096.00,United States,2005,447728,Miscellaneous,Multi-Sector Companies
DLNG,Dynagas LNG Partners LP Common Units,$2.78,0.03,1.091%,99002972.00,Greece,,105761,Consumer Services,Marine Transportation
DLNG^A,Dynagas LNG Partners LP 9.00% Series A Cumulative Redeemable Preferred Units,$24.46,0.045,0.184%,,Greece,,11489,,
DLNG^B,Dynagas LNG Partners LP 8.75% Series B Fixed to Floating Rate Cumulative Redeemable Perpetual Preferred Units liquidation preference $25.00 per Uni,$21.93,-0.61,-2.706%,,Greece,,6549,,
DLR,Digital Realty Trust Inc. Common Stock,$144.82,-2.71,-1.837%,40573521802.00,United States,2004,1521706,Consumer Services,Real Estate Investment Trusts
DLR^C,Digital Realty Trust Inc. 6.625% Series C Cumulative Redeemable Perpetual Preferred Stock,$25.56,-0.16,-0.622%,,United States,,33702,,
DLR^J,Digital Realty Trust Inc. 5.250% Series J Cumulative Redeemable Preferred Stock,$26.14,-0.1399,-0.532%,,United States,,8820,,
DLR^K,Digital Realty Trust Inc. 5.850% Series K Cumulative Redeemable Preferred Stock par value $0.01 per share,$27.36,-0.26,-0.941%,,United States,,11109,,
DLR^L,Digital Realty Trust Inc. 5.200% Series L Cumulative Redeemable Preferred Stock,$26.92,-0.22,-0.811%,,United States,,15289,,
DLX,Deluxe Corporation Common Stock,$38.24,-0.91,-2.324%,1602026101.00,United States,,341050,Consumer Durables,Publishing
DLY,DoubleLine Yield Opportunities Fund Common Shares of Beneficial Interest,$19.52,-0.07,-0.357%,0.00,,2020,92059,,
DM,Desktop Metal Inc. Class A Common Stock,$29.27,-0.55,-1.844%,6635654794.00,,2019,3675329,Technology,Industrial Machinery/Components
DMB,BNY Mellon Municipal Bond Infrastructure Fund Inc. Common Stock,$14.90,0.00,0.00%,273974838.00,,2013,25694,,
DMO,Western Asset Mortgage Opportunity Fund Inc. Common Stock,$14.96,0.425,2.924%,164321807.00,United States,2010,136862,,
DMS,Digital Media Solutions Inc. Class A Ordinary Shares,$12.64,-0.46,-3.511%,738075398.00,United States,2018,166118,Miscellaneous,Business Services
DMYD,dMY Technology Group Inc. II Class A Common Stock,$18.57,-1.06,-5.40%,640665000.00,United States,2020,635170,Finance,Business Services
DMYI,dMY Technology Group Inc. III Class A Common Stock,$11.77,-0.11,-0.926%,446156563.00,United States,2021,83195,Finance,Business Services
DNB,Dun & Bradstreet Holdings Inc. Common Stock,$22.80,-0.26,-1.127%,9643310798.00,United States,2020,2628931,Finance,Finance: Consumer Services
DNK,Phoenix Tree Holdings Limited American Depositary Shares each representing ten (10) Class A ordinary shares,$3.13,0.02,0.643%,572414400.00,,2020,517099,Consumer Services,Building operators
DNMR,Danimer Scientific Inc. Common Stock,$59.56,-4.73,-7.357%,5105755389.00,,2020,2359723,Basic Industries,Major Chemicals
DNOW,NOW Inc. Common Stock,$10.16,0.17,1.702%,1111297010.00,,2014,1021784,Energy,Metal Fabrications
DNP,DNP Select Income Fund Inc. Common Stock,$10.36,-0.01,-0.096%,3204374408.00,United States,1987,581965,,
DOC,Physicians Realty Trust Common Shares of Beneficial Interest,$18.36,-0.02,-0.109%,3823098247.00,United States,2013,1366893,Consumer Services,Real Estate Investment Trusts
DOOR,Masonite International Corporation Ordinary Shares (Canada),$108.80,-0.98,-0.893%,2665922810.00,Canada,,164811,Basic Industries,Forest Products
DOV,Dover Corporation Common Stock,$122.10,-0.68,-0.554%,17595012808.00,United States,,567235,Technology,Industrial Machinery/Components
DOW,Dow Inc. Common Stock ,$57.67,0.00,0.00%,42901552675.00,,2019,2326503,Basic Industries,Major Chemicals
DPG,Duff & Phelps Utility and Infrastructure Fund Inc.,$13.12,-0.20,-1.502%,497639055.00,United States,2011,234590,,
DPZ,Domino's Pizza Inc Common Stock,$385.20,3.14,0.822%,15176843791.00,United States,2004,462093,Consumer Non-Durables,Food Distributors
DQ,DAQO New Energy Corp. American Depositary Shares each representing five ordinary shares,$118.91,-0.62,-0.519%,8262322225.00,China,2010,1257682,Technology,Semiconductors
DRD,DRDGOLD Limited American Depositary Shares,$10.48,-0.09,-0.851%,896159252.00,South Africa,,200470,Basic Industries,Precious Metals
DRE,Duke Realty Corporation Common Stock,$41.96,-0.11,-0.261%,15607071135.00,United States,,1451124,Consumer Services,Real Estate Investment Trusts
DRH,Diamondrock Hospitality Company Common Stock,$8.92,0.04,0.45%,1779708410.00,United States,2005,1275985,Consumer Services,Real Estate Investment Trusts
DRH^A,Diamondrock Hospitality Company 8.250% Series A Cumulative Redeemable Preferred Stock,$26.90,-0.0401,-0.149%,,United States,,1936,,
DRI,Darden Restaurants Inc. Common Stock,$128.92,-0.06,-0.047%,16801907290.00,United States,,849065,Consumer Services,Restaurants
DRQ,Dril-Quip Inc. Common Stock,$33.33,-0.90,-2.629%,1169742847.00,United States,1997,241031,Energy,Metal Fabrications
DRUA,Dominion Energy Inc. 2016 Series A 5.25% Enhanced Junior Subordinated Notes due 2076,$25.48,-0.04,-0.157%,0.00,United States,2016,52796,Public Utilities,Electric Utilities: Central
DS,Drive Shack Inc.,$2.74,-0.11,-3.86%,249989188.00,United States,,3472257,Consumer Services,Restaurants
DS^B,Drive Shack Inc. Preferred Series B,$22.23,1.43,6.875%,,United States,,17329,,
DS^C,Drive Shack Inc. Preferred Series C,$20.76,0.75,3.748%,,United States,,300,,
DS^D,Drive Shack Inc. Pfd Ser D,$21.24,0.74,3.61%,,United States,,1766,,
DSE,Duff & Phelps Select MLP and Midstream Energy Fund Inc.,$6.70,0.00,0.00%,17576479.00,United States,2014,45029,,
DSL,DoubleLine Income Solutions Fund Common Shares of Beneficial Interests,$17.32,-0.08,-0.46%,1765893647.00,,2013,264524,,
DSM,BNY Mellon Strategic Municipal Bond Fund Inc. Common Stock,$8.03,-0.03,-0.372%,396854733.00,United States,1989,49252,,
DSSI,Diamond S Shipping Inc. Common Stock ,$8.50,-0.36,-4.063%,343745041.00,,2019,424874,Consumer Services,Transportation Services
DSU,Blackrock Debt Strategies Fund Inc. Common Stock,$10.84,-0.01,-0.092%,507130365.00,United States,1998,157142,,
DSX,Diana Shipping inc. common stock,$2.97,0.05,1.712%,247326756.00,Greece,2005,1009757,Transportation,Marine Transportation
DSX^B,Diana Shipping Inc. Perpetual Preferred Shares Series B (Marshall Islands),$25.4529,0.0929,0.366%,,Greece,,5978,,
DT,Dynatrace Inc. Common Stock,$54.00,-0.48,-0.881%,15260065362.00,United States,2019,1319831,Technology,Computer Software: Prepackaged Software
DTB,DTE Energy Company 2020 Series G 4.375% Junior Subordinated Debentures due 2080,$25.40,-0.06,-0.236%,0.00,United States,2020,40855,Public Utilities,Electric Utilities: Central
DTE,DTE Energy Company Common Stock,$121.99,-0.17,-0.139%,23612334750.00,United States,,992624,Public Utilities,Electric Utilities: Central
DTF,DTF Tax-Free Income Inc. Common Stock,$14.68,0.00,0.00%,103194029.00,United States,1991,757,,
DTJ,DTE Energy Company 2016 Series B 5.375% Junior Subordinated Debentures due 2076,$25.40,-0.40,-1.55%,0.00,United States,2016,27773,Public Utilities,Electric Utilities: Central
DTLA^,Brookfield DTLA Inc. 7.625% Series A Cumulative Redeemable Preferred Stock,$13.55,-0.15,-1.095%,,,,5039,,
DTP,DTE Energy Company 6.25% Corporate Units,$46.87,-0.14,-0.298%,0.00,United States,,46078,Public Utilities,Electric Utilities: Central
DTW,DTE Energy Company 2017 Series E 5.25% Junior Subordinated Debentures due 2077,$25.89,-0.28,-1.07%,0.00,United States,2017,46189,Public Utilities,Electric Utilities: Central
DTY,DTE Energy Company 2016 Series F 6.00% Junior Subordinated Debentures due 2076,$26.29,-0.26,-0.979%,0.00,United States,2016,11088,Public Utilities,Electric Utilities: Central
DUC,Duff & Phelps Utility & Corporate Bond Trust Inc. Common Stock,$10.39,-0.04,-0.384%,285669756.00,United States,1993,134375,,
DUK,Duke Energy Corporation (Holding Company) Common Stock,$90.42,-3.28,-3.501%,66545372995.00,United States,,3632584,Public Utilities,Power Generation
DUK^A,Duke Energy Corporation Depositary Shares each representing a 1/1000th interest in a share of 5.75% Series A Cumulative Redeemable Perpetual Preferred Stock,$27.75,-0.54,-1.909%,,United States,,66543,Public Utilities,Power Generation
DUKB,Duke Energy Corporation 5.625% Junior Subordinated Debentures due 2078,$27.28,-0.17,-0.619%,0.00,United States,2018,22130,Public Utilities,Power Generation
DUKH,Duke Energy Corporation 5.125% Junior Subordinated Debentures due 2073,$25.77,-0.135,-0.521%,0.00,United States,,18511,Public Utilities,Power Generation
DVA,DaVita Inc. Common Stock,$113.33,-0.06,-0.053%,12687688002.00,United States,,877926,Health Care,Misc Health and Biotechnology Services
DVD,Dover Motorsports Inc. Common Stock,$2.20,-0.03,-1.345%,80019240.00,United States,1996,112855,Consumer Services,Services-Misc. Amusement & Recreation
DVN,Devon Energy Corporation Common Stock,$19.30,-0.43,-2.179%,12990969558.00,United States,,7220910,Energy,Oil & Gas Production
DWIN,Delwinds Insurance Acquisition Corp. Class A Common Stock,$10.10,0.02,0.198%,0.00,,2021,45213,Finance,Business Services
DX,Dynex Capital Inc. Common Stock,$18.51,0.08,0.434%,489551925.00,United States,,244273,Consumer Services,Real Estate Investment Trusts
DX^B,Dynex Capital Inc. Preferred Series B,$25.1401,0.0001,0.00%,,United States,,3697,,
DX^C,Dynex Capital Inc. 6.900% Series C Fixed-to-Floating Rate Cumulative Redeemable Preferred Stock,$25.1489,0.0089,0.035%,,United States,,5550,,
DXC,DXC Technology Company Common Stock ,$25.63,-0.08,-0.311%,6525244041.00,,,1626269,Technology,EDP Services
DY,Dycom Industries Inc. Common Stock,$90.85,-0.04,-0.044%,2899312676.00,United States,,230578,Basic Industries,Water Supply
DYFN,Angel Oak Dynamic Financial Strategies Income Term Trust Common Shares of Beneficial Interest,$18.65,-0.0099,-0.053%,0.00,,2020,10543,,
E,ENI S.p.A. Common Stock,$21.42,-0.15,-0.695%,37955802689.00,Italy,,562971,Energy,Oil & Gas Production
EAF,GrafTech International Ltd. Common Stock,$12.31,-0.07,-0.565%,3289130984.00,United States,2018,1658717,Energy,Industrial Machinery/Components
EAI,Entergy Arkansas LLC First Mortgage Bonds 4.875% Series Due September 1 2066,$25.60,-0.07,-0.273%,0.00,United States,2016,63286,Public Utilities,Electric Utilities: Central
EARN,Ellington Residential Mortgage REIT Common Shares of Beneficial Interest,$12.09,-0.09,-0.739%,149125749.00,United States,2013,67040,Consumer Services,Real Estate Investment Trusts
EAT,Brinker International Inc. Common Stock,$67.15,-0.25,-0.371%,3052645514.00,United States,,672976,Consumer Services,Restaurants
EB,Eventbrite Inc. Class A Common Stock,$17.13,-0.13,-0.753%,1569892965.00,United States,2018,1554757,Technology,Computer Software: Programming Data Processing
EBF,Ennis Inc. Common Stock,$19.68,-0.10,-0.506%,513048606.00,United States,,79997,Consumer Services,Office Equipment/Supplies/Services
EBR,Centrais Electricas Brasileiras S A American Depositary Shares (Each representing one Common Share),$5.47,-0.21,-3.697%,8582052078.00,,2016,932108,Public Utilities,Electric Utilities: Central
EBS,Emergent Biosolutions Inc. Common Stock,$123.87,3.95,3.294%,6565003348.00,United States,2006,472929,Health Care,Major Pharmaceuticals
EC,Ecopetrol S.A. American Depositary Shares,$12.21,-0.11,-0.893%,25101742102.00,Colombia,,510645,Energy,Oil & Gas Production
ECC           ,Eagle Point Credit Company Inc. Common Stock,$11.42,-0.12,-1.04%,361734598.00,United States,2014,132842,,
ECCB,Eagle Point Credit Company Inc. 7.75% Series B Term Preferred Stock due 2026,$25.25,-0.20,-0.786%,0.00,United States,2016,10787,,
ECCX,Eagle Point Credit Company Inc. 6.6875% Notes due 2028,$25.44,0.0403,0.159%,0.00,United States,2018,1216,,
ECCY,Eagle Point Credit Company Inc. 6.75% Notes due 2027,$25.32,0.00,0.00%,0.00,United States,2017,144,,
ECL,Ecolab Inc. Common Stock,$216.40,0.75,0.348%,61770337601.00,United States,,911384,Basic Industries,Package Goods/Cosmetics
ECOM          ,ChannelAdvisor Corporation Common Stock,$28.42,2.92,11.451%,824184263.00,United States,2013,923956,Technology,Computer Software: Prepackaged Software
ED,Consolidated Edison Inc. Common Stock,$71.82,-0.49,-0.678%,24053646149.00,United States,,1792013,Public Utilities,Power Generation
EDD,Morgan Stanley Emerging Markets Domestic Debt Fund Inc. Morgan Stanley Emerging Markets Domestic Debt Fund Inc. Common Stock,$6.24,0.03,0.483%,412414860.00,United States,2007,130061,,
EDF,Stone Harbor Emerging Markets Income Fund Common Shares of Beneficial Interest,$8.60,-0.16,-1.826%,143412482.00,United States,2010,76985,,
EDI,Stone Harbor Emerging Markets Total Income Fund Common Shares of Beneficial Interests,$9.11,-0.24,-2.567%,89990019.00,United States,2012,40649,,
EDN,Empresa Distribuidora Y Comercializadora Norte S.A. (Edenor) Empresa Distribuidora Y Comercializadora Norte S.A. (Edenor) American Depositary Shares,$3.74,0.02,0.538%,163638879.00,Argentina,2007,31500,Public Utilities,Electric Utilities: Central
EDU,New Oriental Education & Technology Group Inc. Sponsored ADR representing 1 Ordinary Share (Cayman Islands),$192.47,2.29,1.204%,32751828271.00,China,2006,567272,Consumer Services,Other Consumer Services
EEA,The European Equity Fund Inc. Common Stock,$10.4399,-0.0102,-0.098%,77831887.00,United States,,25203,,
EEX,Emerald Holding Inc. Common Stock,$4.77,0.03,0.633%,340772044.00,United States,2017,91513,Miscellaneous,Business Services
EFC,Ellington Financial Inc. Common Stock ,$15.68,-0.02,-0.127%,686496805.00,United States,2010,155336,Finance,Real Estate
EFC^A,Ellington Financial Inc. 6.750% Series A Fixed-to-Floating Rate Cumulative Redeemable Preferred Stock,$24.18,0.04,0.166%,,United States,,8152,,
EFF,Eaton vance Floating-Rate Income Plus Fund Common Shares of Beneficial Interest,$15.97,0.00,0.00%,121474559.00,,2013,16564,,
EFL,Eaton Vance Floating-Rate 2022 Target Term Trust Common Shares of Beneficial Interest,$9.28,-0.03,-0.322%,219208559.00,United States,2017,30365,,
EFR,Eaton Vance Senior Floating-Rate Fund Common Shares of Beneficial Interest,$13.61,0.05,0.369%,501505540.00,United States,2003,56589,,
EFT,Eaton Vance Floating Rate Income Trust Common Shares of Beneficial Interest,$13.91,-0.02,-0.144%,554503928.00,United States,2004,46697,,
EFX,Equifax Inc. Common Stock,$176.95,-6.05,-3.306%,21524720887.00,United States,,1792466,Finance,Finance: Consumer Services
EGF,Blackrock Enhanced Government Fund Inc. Common Stock,$13.154,-0.0366,-0.277%,56055626.00,United States,2005,1979,,
EGHT,8x8 Inc Common Stock,$35.83,0.37,1.043%,3851236780.00,United States,,816474,Technology,EDP Services
EGO,Eldorado Gold Corporation Ordinary Shares,$13.03,-0.22,-1.66%,2277629302.00,Canada,,1403917,Basic Industries,Precious Metals
EGP,EastGroup Properties Inc. Common Stock,$145.98,0.78,0.537%,5774520641.00,United States,,150204,Consumer Services,Real Estate Investment Trusts
EGY,VAALCO Energy Inc.  Common Stock,$2.92,-0.04,-1.351%,167771926.00,United States,,226270,Energy,Oil & Gas Production
EHC,Encompass Health Corporation Common Stock,$82.85,0.76,0.926%,8237979642.00,United States,,476008,Health Care,Hospital/Nursing Management
